UserID_1,UserID_2,Date_Time,Message
7996,2726,2018-12-07 15:37:06,suspendisse potenti nullam porttitor lacus at
7996,2552,2019-01-06 13:23:40,nibh fusce lacus
7996,5314,2018-04-29 00:28:10,sagittis dui vel nisl duis ac
7996,9483,2018-02-03 06:20:20,est donec odio justo
7996,6041,2018-03-14 00:51:48,vestibulum sed magna
7996,8969,2018-07-05 13:04:15,venenatis lacinia aenean sit amet justo
7996,7343,2018-09-17 17:47:14,curae duis faucibus accumsan
7996,3753,2018-02-03 00:33:47,arcu sed augue
7996,9495,2018-08-28 08:09:34,fusce lacus purus aliquet at
7996,9496,2018-11-26 03:12:30,porttitor lacus at
7996,9497,2019-01-06 17:19:19,nunc nisl duis
7996,9503,2018-02-27 04:39:43,sed ante vivamus tortor duis mattis egestas
7996,9504,2018-07-12 19:47:57,lectus in est risus auctor sed tristique
7996,9505,2018-07-24 21:50:21,neque duis bibendum morbi non quam
7996,4150,2018-11-19 20:07:57,scelerisque quam turpis adipiscing lorem vitae mattis
7996,9506,2018-07-16 08:54:11,et ultrices posuere
7996,7394,2018-06-07 14:49:46,cum sociis natoque penatibus
2849,3005,2018-11-15 01:24:44,amet eleifend pede libero quis orci nullam
2849,2854,2018-12-17 02:50:50,non ligula pellentesque ultrices
2849,9509,2018-08-15 19:41:05,erat tortor sollicitudin mi sit
2849,1849,2018-03-01 01:26:30,in sagittis dui vel nisl duis ac
2849,3567,2018-06-17 03:57:47,congue elementum in hac habitasse platea dictumst
2849,762,2018-08-04 06:18:37,massa id nisl venenatis
2849,2870,2018-09-10 12:33:40,nunc nisl duis
2849,7348,2018-07-11 15:48:28,orci nullam molestie nibh in lectus pellentesque
2849,2576,2018-10-05 18:42:06,ultrices libero non mattis pulvinar nulla pede
2849,9512,2018-08-14 14:09:38,vulputate justo in blandit ultrices
2849,9513,2018-09-07 18:39:44,sit amet nunc
2849,1656,2018-07-07 23:59:03,vulputate vitae nisl aenean lectus pellentesque
2849,9518,2018-12-09 18:51:16,porttitor pede justo eu massa donec
2849,771,2018-07-30 19:00:29,et magnis dis parturient
5688,4563,2018-08-26 00:36:26,ac consequat metus sapien
5688,1150,2018-07-27 07:24:21,felis fusce posuere felis
5688,2759,2018-07-19 22:47:51,nulla eget eros elementum
5688,7145,2018-12-27 15:09:45,nunc rhoncus dui vel sem sed sagittis
5688,82,2018-10-28 23:04:47,lorem id ligula suspendisse ornare consequat
5688,7481,2018-09-28 02:09:21,nullam sit amet turpis elementum ligula vehicula
5688,4281,2018-03-13 03:15:43,vestibulum ac est lacinia
5688,7641,2018-04-23 23:19:00,gravida sem praesent id massa id
9524,5929,2018-07-03 04:05:00,ornare imperdiet sapien
9524,9525,2018-08-12 16:02:18,nisl duis bibendum felis sed
9524,9526,2018-07-15 08:21:06,ridiculus mus vivamus vestibulum sagittis sapien cum
9524,9527,2018-03-08 22:15:37,vitae consectetuer eget rutrum
9524,9530,2018-12-28 12:04:24,feugiat non pretium quis lectus suspendisse
9524,9531,2018-03-28 02:29:10,quis tortor id nulla ultrices aliquet maecenas
9524,6898,2018-04-22 13:24:24,eget rutrum at lorem integer tincidunt
1235,33,2018-08-09 09:34:30,hac habitasse platea dictumst
1235,4866,2018-10-16 19:31:42,nulla elit ac nulla sed
1235,9536,2018-10-30 17:34:03,orci mauris lacinia sapien quis
1235,9537,2018-10-20 19:10:24,ultrices posuere cubilia
6446,681,2018-04-22 22:49:11,amet consectetuer adipiscing elit
6446,9539,2018-01-23 08:28:11,convallis tortor risus dapibus augue vel accumsan
6446,8384,2018-03-27 04:20:09,est phasellus sit amet erat nulla
6446,2555,2018-11-21 22:34:12,mattis odio donec vitae
6446,4607,2018-03-21 14:33:10,magna at nunc commodo placerat praesent blandit
6446,9541,2018-01-05 13:46:27,id ornare imperdiet sapien urna pretium nisl
6446,198,2018-09-09 05:57:35,non ligula pellentesque
6446,9544,2018-06-12 13:25:56,quis odio consequat varius integer ac leo
6446,2458,2018-05-06 18:04:08,ac nibh fusce lacus purus
6446,1874,2018-01-26 22:58:18,aliquet massa id lobortis convallis tortor
4718,2755,2018-04-06 08:16:05,ultrices posuere cubilia curae nulla dapibus
4718,5818,2018-02-05 08:57:32,dignissim vestibulum vestibulum ante
4718,8962,2018-05-30 22:51:23,proin risus praesent
4718,7202,2018-09-14 18:08:18,odio cras mi
4718,8184,2018-07-30 09:37:11,donec quis orci eget orci
4718,5104,2018-04-13 15:54:41,mi pede malesuada in imperdiet et
4718,5166,2018-11-26 08:11:36,vel pede morbi porttitor
4718,6735,2018-01-01 09:03:19,vivamus metus arcu adipiscing molestie hendrerit
4718,7930,2018-05-28 01:37:03,orci luctus et ultrices
2811,750,2018-11-12 00:57:43,gravida sem praesent id
2811,1133,2018-10-06 11:04:37,mattis pulvinar nulla pede ullamcorper
2811,4680,2018-12-04 21:34:10,posuere nonummy integer non velit donec diam
2811,7141,2018-12-17 15:14:08,in ante vestibulum
2811,2126,2018-08-14 08:11:24,erat curabitur gravida nisi
2811,9551,2018-05-25 18:32:22,pede ac diam cras pellentesque volutpat dui
2811,639,2018-11-01 10:26:08,lacinia eget tincidunt eget tempus vel
2811,4661,2018-08-08 16:25:15,duis at velit eu est congue
2811,2152,2018-01-23 14:07:36,eros viverra eget congue eget semper
2811,2332,2018-08-28 20:44:37,semper est quam pharetra magna ac
2811,2155,2018-06-13 18:37:57,tempor convallis nulla neque libero
2811,7151,2018-06-15 01:25:05,pellentesque ultrices phasellus id
2811,7615,2018-10-29 19:18:02,mauris lacinia sapien
2811,207,2018-01-27 21:11:53,phasellus sit amet erat nulla tempus vivamus
4601,4472,2018-04-05 10:32:28,posuere metus vitae
4601,2399,2018-05-13 11:50:34,ridiculus mus etiam vel augue vestibulum rutrum
4601,242,2018-08-18 05:40:03,nec sem duis
4601,4595,2018-03-03 07:41:53,praesent blandit lacinia
4601,9555,2018-07-13 11:54:44,sit amet erat nulla tempus vivamus in
9557,7145,2018-01-30 10:48:56,semper interdum mauris ullamcorper purus sit amet
9557,2806,2018-10-06 08:39:16,dapibus at diam
9559,7307,2018-06-09 20:05:25,vel lectus in quam fringilla rhoncus mauris
8282,6141,2018-01-10 17:02:24,fusce congue diam
8282,9246,2018-07-02 20:18:54,consequat varius integer ac
8282,4329,2018-08-20 06:23:10,volutpat in congue
8282,9562,2018-06-11 19:34:45,nulla neque libero convallis
8282,7034,2018-03-25 16:59:52,in tempus sit amet sem fusce
8282,297,2018-12-12 14:36:06,amet erat nulla tempus vivamus
8282,7834,2018-03-10 07:57:49,lacinia nisi venenatis tristique fusce
8282,9570,2018-06-02 19:23:14,at nulla suspendisse potenti
8282,7341,2018-09-27 13:17:38,tempus semper est quam pharetra magna
8282,2530,2018-03-07 07:26:09,cubilia curae donec
8282,9574,2018-12-20 03:00:17,et tempus semper
8282,9575,2018-01-21 00:41:12,non mi integer ac
8282,9580,2018-08-11 23:43:12,nulla sed accumsan felis ut
8282,4084,2018-04-17 16:30:35,pulvinar sed nisl nunc rhoncus dui vel
8282,8308,2018-09-18 00:19:40,consequat lectus in est risus auctor sed
1351,1036,2018-07-09 22:57:31,amet eleifend pede
1351,1037,2018-09-04 09:24:55,blandit nam nulla integer pede justo
1351,240,2018-02-23 16:11:53,lacus purus aliquet at feugiat non
1351,1042,2018-10-18 06:54:08,neque libero convallis eget eleifend luctus ultricies
1351,2759,2018-09-08 18:48:44,in libero ut massa
1351,1352,2018-01-12 02:56:55,interdum in ante vestibulum ante ipsum primis
1351,1159,2018-02-22 03:37:16,eget massa tempor convallis nulla neque
1351,745,2018-01-13 02:26:37,mattis odio donec vitae
667,1146,2018-02-12 00:58:32,eu massa donec dapibus duis at velit
667,240,2018-05-12 07:27:07,dui luctus rutrum nulla tellus in sagittis
667,241,2018-07-27 11:43:58,tortor id nulla ultrices aliquet
667,242,2018-01-12 19:35:50,in imperdiet et commodo vulputate
667,1148,2018-09-12 12:45:24,vestibulum quam sapien varius ut blandit non
667,2814,2019-01-03 02:16:58,interdum mauris non ligula
667,665,2018-01-02 06:01:31,sapien iaculis congue vivamus
667,5295,2018-09-26 03:13:35,turpis sed ante
667,1042,2018-11-03 08:32:28,interdum mauris ullamcorper purus sit amet
667,3781,2018-06-29 20:22:46,ipsum primis in
667,248,2018-06-03 07:31:43,suspendisse potenti cras in purus
667,250,2018-11-14 21:02:40,quam sapien varius
667,261,2018-10-19 02:49:35,at velit vivamus vel
667,4838,2018-12-21 23:25:57,ut tellus nulla ut
667,9585,2018-05-11 17:07:47,mattis nibh ligula nec sem duis
667,4250,2018-12-16 04:56:38,consequat metus sapien ut nunc vestibulum ante
667,273,2018-11-23 09:51:34,augue vestibulum ante ipsum primis
667,9584,2018-12-30 13:52:33,phasellus id sapien in sapien iaculis congue
667,9586,2018-10-01 12:21:42,posuere cubilia curae nulla dapibus dolor vel
667,9587,2018-08-12 05:00:01,maecenas ut massa quis augue luctus
667,6138,2018-06-23 13:58:39,nulla nunc purus phasellus in felis donec
9590,7007,2018-04-20 10:39:12,rutrum nulla tellus in sagittis dui
9590,862,2018-11-08 15:01:47,at turpis a
9590,9591,2018-11-17 10:27:13,et commodo vulputate justo in blandit ultrices
9590,2763,2018-11-11 10:23:55,eleifend luctus ultricies
9590,9593,2018-06-18 07:24:34,rutrum nulla nunc purus phasellus in felis
9590,7201,2018-02-19 00:24:29,neque vestibulum eget
9590,1663,2018-03-24 11:06:50,in hac habitasse platea dictumst
9590,2895,2018-03-28 16:44:46,venenatis non sodales sed tincidunt
9590,9596,2018-01-03 19:08:10,donec vitae nisi nam ultrices libero
9590,23,2018-10-31 15:39:50,luctus rutrum nulla tellus
9590,8969,2018-09-27 15:32:36,in hac habitasse platea dictumst
9590,6022,2018-11-22 23:34:03,gravida sem praesent
9590,4142,2018-08-26 19:56:40,id ligula suspendisse ornare
9590,1816,2018-07-04 23:39:43,at velit vivamus vel nulla eget
9590,9605,2018-03-03 09:51:25,lacus curabitur at ipsum ac
9590,9607,2018-03-08 18:38:05,ipsum primis in
9590,7365,2018-07-12 03:49:14,nisl duis ac nibh fusce lacus purus
9590,9613,2018-02-12 17:28:47,in felis eu sapien cursus vestibulum
9590,3971,2018-01-24 19:55:52,volutpat convallis morbi odio odio
9590,9618,2018-01-12 15:34:07,at ipsum ac
9590,9619,2018-02-24 16:11:43,lobortis ligula sit amet eleifend
9590,4847,2018-12-13 16:23:09,praesent blandit lacinia erat vestibulum
9590,2432,2018-04-15 07:41:07,lobortis convallis tortor
9590,9624,2018-08-26 03:14:59,mattis nibh ligula
9590,9630,2018-03-25 09:50:03,lectus in quam fringilla
9590,9632,2018-10-14 09:43:29,aenean lectus pellentesque eget nunc donec quis
9590,9634,2018-03-16 20:32:12,justo lacinia eget tincidunt
9590,9636,2018-11-03 02:32:25,tortor id nulla ultrices aliquet
9590,9637,2018-06-14 13:03:38,sed nisl nunc rhoncus dui
9590,9638,2019-01-06 16:16:57,eu interdum eu tincidunt in
9590,9639,2018-03-10 11:37:20,donec ut dolor
9590,9641,2018-02-11 06:17:27,accumsan felis ut at dolor quis odio
9590,9644,2018-07-08 00:38:06,imperdiet sapien urna pretium nisl ut volutpat
9590,9646,2018-12-11 16:33:32,tortor sollicitudin mi sit amet lobortis
9590,9647,2018-01-20 09:35:13,lacinia erat vestibulum
75,9650,2018-04-12 11:07:13,congue vivamus metus arcu adipiscing molestie hendrerit
75,2932,2018-07-18 22:42:10,nisl nunc rhoncus dui
75,4123,2019-01-01 14:42:30,vehicula consequat morbi a ipsum integer a
75,9655,2018-11-15 06:06:27,vitae mattis nibh
75,7741,2018-07-23 13:23:29,non mi integer ac neque duis bibendum
75,9658,2018-12-14 21:43:15,felis donec semper sapien a
75,9659,2018-11-30 20:26:42,sit amet diam in magna
75,9661,2018-10-03 06:47:43,egestas metus aenean fermentum donec ut
7018,245,2018-11-30 00:52:17,odio odio elementum eu
7018,9665,2018-10-30 00:44:02,eget rutrum at lorem
7018,6256,2018-10-02 06:50:54,consequat lectus in
9555,9667,2018-09-18 07:48:24,vel pede morbi porttitor lorem
9555,9674,2018-11-29 16:47:07,non mattis pulvinar nulla
9555,9675,2018-09-10 19:05:59,odio odio elementum eu interdum eu tincidunt
6129,6082,2018-05-07 22:47:23,turpis elementum ligula vehicula consequat
6129,1040,2018-08-13 21:52:52,elementum nullam varius nulla facilisi cras non
6129,1352,2018-12-01 23:17:51,a odio in hac habitasse
6129,3188,2018-06-22 23:13:18,cras pellentesque volutpat dui maecenas
6129,9679,2018-05-01 01:56:44,nec sem duis aliquam convallis nunc proin
6129,9542,2018-01-11 09:49:47,maecenas tristique est et
6129,2458,2018-01-24 23:21:10,consectetuer adipiscing elit proin
6129,6137,2018-07-15 08:05:28,dignissim vestibulum vestibulum ante ipsum
6129,1874,2018-11-21 13:11:42,hac habitasse platea
668,658,2018-12-10 22:10:46,tempus semper est
668,659,2018-04-01 09:39:51,est donec odio justo sollicitudin ut suscipit
668,4482,2018-09-02 15:38:48,suscipit a feugiat et eros
668,4811,2018-04-04 10:34:13,tellus in sagittis dui vel
668,3791,2018-04-27 18:05:17,luctus cum sociis natoque penatibus et
668,2814,2018-03-18 20:17:03,eu mi nulla
668,243,2018-11-15 19:55:51,cras non velit
668,4560,2018-08-05 10:33:10,varius ut blandit non interdum
668,4483,2018-12-06 00:11:20,mauris ullamcorper purus sit amet nulla
668,4484,2018-03-22 06:10:08,sed vestibulum sit
668,1128,2018-10-04 04:12:09,risus dapibus augue vel accumsan tellus
668,671,2018-10-25 00:48:11,curae duis faucibus accumsan odio curabitur convallis
668,742,2018-10-30 02:40:45,id consequat in consequat
668,4485,2018-06-02 21:29:00,duis mattis egestas metus aenean
668,672,2018-05-13 06:19:24,suspendisse potenti cras
668,673,2018-08-26 23:03:20,ante vivamus tortor duis mattis egestas
668,674,2018-08-04 10:15:40,integer ac leo pellentesque ultrices mattis odio
668,688,2018-12-14 15:27:48,dignissim vestibulum vestibulum ante ipsum
668,5402,2018-03-06 04:45:13,ultrices libero non mattis pulvinar
668,3159,2018-03-31 02:08:46,nulla facilisi cras non velit nec nisi
668,1130,2018-03-26 06:42:52,in sagittis dui vel nisl duis ac
668,3770,2018-07-10 17:19:35,non pretium quis lectus
668,1131,2018-02-15 14:32:34,libero rutrum ac
668,677,2018-05-03 13:36:54,posuere felis sed lacus morbi sem
7141,7936,2018-09-27 07:39:22,pede justo lacinia eget tincidunt
7141,9682,2018-03-09 09:34:52,sit amet sem fusce consequat nulla nisl
7141,7144,2018-10-05 18:58:02,rutrum ac lobortis vel dapibus
7141,2129,2018-06-16 08:57:06,odio donec vitae nisi
7141,2143,2018-10-20 01:55:11,nonummy maecenas tincidunt lacus
5032,4956,2018-02-18 16:11:24,vulputate justo in blandit
5032,5402,2018-07-28 06:25:18,phasellus id sapien in sapien iaculis
5032,2305,2018-05-23 17:38:29,mattis odio donec vitae
5032,9686,2018-10-13 17:14:56,lobortis ligula sit amet eleifend
5032,3880,2018-01-08 22:12:23,dapibus at diam nam tristique tortor
5032,9694,2018-02-26 12:34:02,ut suscipit a feugiat et
5032,7511,2018-03-16 05:07:33,lacus morbi sem mauris laoreet ut
5032,4293,2018-07-06 13:34:09,a nibh in quis justo maecenas
5032,3891,2019-01-02 15:29:30,erat nulla tempus vivamus in felis eu
5032,4374,2019-01-01 15:44:44,sem sed sagittis nam congue risus
5032,8407,2018-02-23 12:36:18,pellentesque eget nunc donec quis
5032,9695,2018-09-19 19:08:43,vestibulum ac est lacinia
5032,7520,2018-09-24 05:12:35,volutpat dui maecenas tristique est et
5032,3900,2018-11-01 02:53:18,justo etiam pretium iaculis
5032,9698,2018-11-16 08:31:47,mattis nibh ligula nec sem
5032,9700,2018-12-15 18:04:33,eu interdum eu
5032,8412,2018-07-03 09:13:18,posuere cubilia curae
5032,7301,2018-05-05 17:51:11,quis turpis eget elit sodales scelerisque mauris
5032,7536,2018-05-25 09:11:35,ipsum dolor sit amet consectetuer adipiscing elit
5032,9706,2018-12-03 21:27:57,in magna bibendum imperdiet nullam orci pede
5032,5457,2018-02-09 18:58:33,aliquet ultrices erat
5032,9708,2018-10-03 02:22:29,pretium iaculis justo in hac
5032,9710,2018-06-28 14:10:20,ante ipsum primis
5032,4304,2018-10-28 23:14:07,vestibulum sit amet cursus id turpis integer
5032,9712,2018-01-28 10:31:30,dolor sit amet consectetuer adipiscing
5032,9713,2018-08-20 14:54:34,et ultrices posuere cubilia curae
5032,3924,2018-06-14 16:04:12,eget eros elementum pellentesque quisque
5032,3925,2018-05-11 17:13:54,faucibus cursus urna ut tellus
5032,7079,2018-06-25 10:51:13,aliquam convallis nunc proin at turpis a
5032,9720,2018-09-30 00:09:15,magna bibendum imperdiet nullam orci pede venenatis
5032,9721,2018-04-03 15:19:09,consectetuer adipiscing elit
5032,7961,2018-12-03 04:24:06,in magna bibendum imperdiet nullam
5032,9726,2019-01-06 06:52:43,consequat metus sapien ut nunc
5032,9727,2018-06-12 15:55:55,convallis duis consequat dui nec nisi
5032,1103,2018-12-11 00:53:19,nulla pede ullamcorper augue a suscipit nulla
5032,8240,2018-08-04 20:32:23,donec pharetra magna vestibulum
5032,9733,2018-10-28 08:33:28,nisl ut volutpat sapien arcu sed
5032,2349,2018-01-23 21:35:23,ultrices posuere cubilia curae duis
5032,9337,2018-05-30 20:12:23,dapibus duis at velit eu est congue
5032,2560,2018-09-13 05:39:41,at velit vivamus vel nulla eget eros elementum pellentesque
5032,3950,2018-02-19 11:14:38,id pretium iaculis
5032,9738,2018-11-07 07:18:58,tempus semper est quam pharetra magna ac consequat metus sapien
5032,9739,2018-01-08 17:12:44,nulla dapibus dolor vel est donec odio justo
5032,9233,2018-01-27 03:50:56,nibh in lectus
5032,3957,2018-12-23 05:07:19,viverra dapibus nulla suscipit ligula in lacus
9745,9746,2018-08-05 13:06:24,cras in purus
9745,9747,2018-10-16 09:57:34,congue risus semper porta
9745,7658,2018-12-25 00:26:43,nunc commodo placerat praesent blandit nam nulla integer
9745,9748,2018-03-18 09:25:09,morbi vel lectus in quam fringilla rhoncus mauris enim leo
9745,6062,2018-11-11 21:48:03,tincidunt nulla mollis molestie lorem quisque ut erat
9745,9749,2018-01-28 01:46:02,tincidunt ante vel ipsum praesent blandit lacinia erat vestibulum sed
9745,9751,2018-08-31 12:47:56,etiam justo etiam pretium iaculis
9745,9752,2018-03-20 10:57:37,vel augue vestibulum rutrum rutrum neque aenean auctor gravida sem
9745,9755,2018-03-23 04:09:08,sapien arcu sed augue aliquam erat volutpat in congue etiam
9745,5559,2018-08-07 19:49:41,volutpat eleifend donec ut dolor morbi vel lectus in
9745,9757,2018-03-25 10:08:00,ornare imperdiet sapien urna pretium nisl
9745,8973,2018-08-31 13:52:27,hac habitasse platea dictumst etiam faucibus
9745,5563,2018-01-10 18:45:46,velit vivamus vel nulla eget eros elementum pellentesque quisque porta
9745,8342,2018-04-18 13:55:54,mattis pulvinar nulla pede ullamcorper augue
9745,9769,2018-03-26 18:10:51,suspendisse potenti cras
9745,9771,2018-12-15 22:34:42,libero non mattis pulvinar nulla pede ullamcorper
9745,9773,2018-08-15 18:38:35,ut erat id mauris
9745,9775,2018-03-19 16:03:29,ultrices posuere cubilia curae duis faucibus accumsan
9745,9778,2018-12-22 06:44:39,dapibus at diam nam tristique
9745,2625,2018-09-02 19:53:11,mus vivamus vestibulum sagittis sapien cum sociis
9745,9786,2018-01-27 05:38:16,donec ut mauris eget massa tempor convallis nulla neque libero
9745,9788,2019-01-01 08:38:34,congue vivamus metus arcu adipiscing molestie hendrerit at
9745,9789,2018-11-30 07:02:27,curae donec pharetra magna vestibulum aliquet ultrices erat tortor
9745,351,2018-03-15 16:32:34,rutrum rutrum neque aenean
9745,5586,2018-10-13 17:31:38,blandit lacinia erat vestibulum sed magna at nunc commodo placerat
9745,9795,2018-11-20 02:39:42,a feugiat et
9745,6072,2018-05-03 19:35:01,nisi venenatis tristique
7574,4565,2018-02-28 01:38:44,turpis donec posuere metus vitae ipsum aliquam non mauris
7574,5819,2018-12-24 07:02:46,id nisl venenatis lacinia aenean
7574,5041,2018-12-19 21:08:52,vel est donec odio justo sollicitudin ut suscipit a
7574,9796,2018-12-28 06:54:13,pede posuere nonummy integer non velit donec diam neque vestibulum
7574,1902,2018-06-16 00:34:20,pellentesque at nulla suspendisse potenti cras in purus eu magna
7574,9799,2018-05-22 05:24:27,dictumst maecenas ut massa
7574,9801,2018-04-23 20:14:24,tortor sollicitudin mi sit amet lobortis sapien
7574,9805,2018-01-10 05:16:51,integer pede justo lacinia eget
7574,4299,2018-04-29 17:20:16,pede ac diam
7574,9807,2018-12-09 15:47:09,in faucibus orci luctus et ultrices posuere
7574,9808,2018-04-27 16:51:27,turpis adipiscing lorem vitae mattis nibh ligula
7574,2332,2018-12-13 13:49:30,at ipsum ac tellus semper interdum mauris ullamcorper purus sit
7574,1103,2018-06-12 17:34:00,massa quis augue luctus tincidunt nulla mollis molestie lorem quisque
9818,2311,2018-08-19 17:50:27,nunc vestibulum ante ipsum primis
7936,7141,2018-08-24 21:06:41,rhoncus aliquam lacus morbi quis tortor id nulla
7936,2143,2018-02-07 12:33:19,mauris vulputate elementum nullam varius nulla facilisi cras non
5334,1043,2018-07-04 21:15:55,in quam fringilla rhoncus mauris enim leo rhoncus sed vestibulum
5334,2760,2018-11-23 20:21:45,suspendisse accumsan tortor
5334,3748,2018-02-07 19:48:03,rhoncus aliquam lacus morbi quis tortor id nulla
5334,9822,2018-09-02 22:56:08,eget vulputate ut ultrices
5334,9823,2018-03-01 14:11:54,est phasellus sit amet erat nulla tempus
9663,7018,2018-02-22 01:10:07,sem sed sagittis nam
9663,9343,2018-12-01 05:50:57,porta volutpat erat
9663,2879,2018-02-23 03:04:40,massa tempor convallis nulla neque libero convallis
7307,3131,2018-04-07 16:15:45,egestas metus aenean fermentum donec ut mauris
7307,9559,2018-06-11 07:07:39,posuere cubilia curae donec pharetra magna vestibulum aliquet ultrices
1832,1829,2018-01-02 13:34:49,a nibh in quis justo maecenas rhoncus aliquam lacus morbi
1832,2117,2018-09-08 07:51:09,at diam nam tristique tortor
1832,3115,2018-08-08 03:45:04,est risus auctor sed tristique in tempus sit amet sem
1832,750,2018-10-01 15:57:52,aenean fermentum donec ut mauris
1832,5851,2018-09-05 14:17:29,ipsum primis in faucibus orci luctus et ultrices posuere
1832,2002,2018-02-02 03:55:39,aliquam quis turpis eget elit sodales scelerisque mauris sit
1832,2134,2018-02-24 19:04:37,augue vestibulum ante ipsum primis in faucibus orci
1832,357,2018-08-28 22:22:52,diam cras pellentesque volutpat dui maecenas tristique est
1832,1160,2018-08-07 11:20:02,erat volutpat in congue etiam justo
1832,1868,2018-01-29 02:58:20,vulputate luctus cum sociis natoque penatibus et magnis dis parturient
1832,5585,2018-01-08 00:32:28,in consequat ut nulla sed accumsan felis
9825,5034,2018-01-17 14:32:10,in faucibus orci luctus et ultrices posuere
9825,8397,2018-01-28 23:19:30,odio cras mi pede malesuada in imperdiet et
9825,785,2018-05-28 10:32:11,duis faucibus accumsan odio curabitur
9825,3588,2018-03-01 21:31:25,dolor sit amet consectetuer adipiscing elit
9825,5058,2018-07-05 03:14:51,sapien dignissim vestibulum vestibulum ante
9825,9827,2018-06-04 11:19:46,elementum in hac
9825,5067,2018-05-30 05:17:45,rutrum neque aenean auctor
9825,4293,2018-02-28 06:39:28,nunc rhoncus dui vel sem sed
9825,5081,2018-03-07 23:30:55,dis parturient montes
9825,9830,2018-02-19 12:10:08,luctus et ultrices posuere cubilia
9825,4374,2018-01-29 07:38:29,etiam faucibus cursus
9825,816,2018-04-09 05:06:09,eget tincidunt eget tempus vel pede morbi porttitor lorem
9825,9832,2018-02-13 19:48:05,euismod scelerisque quam turpis
9825,9834,2018-01-21 23:29:00,in purus eu magna vulputate luctus cum sociis
9825,9836,2018-04-12 08:44:52,tellus nulla ut erat id mauris vulputate
9825,1217,2018-12-11 16:29:11,suscipit a feugiat et eros vestibulum ac
9825,9839,2018-03-25 22:14:37,urna ut tellus nulla ut
9825,7585,2018-05-01 09:47:05,potenti nullam porttitor lacus
9825,3909,2018-09-03 21:54:32,rutrum rutrum neque aenean auctor
9825,9842,2018-01-15 20:27:05,eros viverra eget congue eget semper rutrum
9825,9843,2018-09-08 00:48:32,in magna bibendum
9825,9844,2018-10-21 23:36:18,curabitur gravida nisi at
9825,817,2018-05-10 10:19:39,id pretium iaculis diam erat fermentum justo nec condimentum
9825,9848,2018-01-17 04:40:42,eget congue eget semper rutrum nulla nunc purus
9825,5124,2018-07-06 06:38:22,et eros vestibulum ac
9825,9853,2018-11-08 08:28:59,felis ut at dolor quis odio consequat varius
9825,9862,2018-03-29 05:55:49,justo sollicitudin ut suscipit a feugiat et eros vestibulum ac
9825,9863,2018-03-14 16:37:45,suspendisse ornare consequat lectus in est risus auctor sed tristique
9825,451,2018-02-02 20:17:32,interdum mauris non ligula pellentesque ultrices phasellus id
9825,9870,2018-03-24 23:37:40,donec posuere metus vitae
9825,9871,2018-04-09 23:04:51,ullamcorper augue a suscipit nulla elit ac nulla
9825,3652,2018-05-18 04:31:48,ipsum aliquam non mauris morbi non
9825,8653,2018-06-05 15:16:46,rutrum rutrum neque aenean auctor gravida
9825,9883,2018-05-26 22:10:54,orci vehicula condimentum curabitur in libero ut massa volutpat
9825,9884,2018-01-01 20:30:13,vel ipsum praesent blandit lacinia erat vestibulum sed
9825,9889,2018-03-26 17:09:00,erat eros viverra
9825,9890,2018-05-16 04:31:07,proin eu mi nulla ac enim in tempor turpis nec
9825,8667,2018-08-30 22:27:00,sed ante vivamus tortor duis mattis egestas metus aenean
9825,9891,2018-10-13 22:10:20,dolor morbi vel lectus
9825,3943,2018-02-18 12:43:40,arcu adipiscing molestie hendrerit
9825,9895,2018-11-01 07:31:40,amet erat nulla tempus vivamus in
9825,9899,2018-04-06 11:05:20,lobortis ligula sit amet eleifend
9825,9901,2018-02-16 13:26:02,tempor convallis nulla neque libero
9825,9902,2018-02-14 23:41:25,at lorem integer tincidunt ante vel ipsum praesent blandit lacinia
9825,9903,2018-04-16 12:16:46,id ligula suspendisse ornare consequat lectus
9825,9907,2018-06-24 17:25:22,libero non mattis pulvinar nulla pede ullamcorper augue
9825,9909,2018-04-20 22:26:49,justo eu massa donec dapibus duis at velit
9825,9912,2018-02-08 21:23:24,mi sit amet lobortis sapien sapien non mi
9825,9913,2018-06-03 21:26:18,interdum eu tincidunt in leo maecenas pulvinar
9825,9914,2018-02-01 02:07:30,primis in faucibus orci luctus et ultrices posuere cubilia
9825,9915,2018-07-19 13:18:16,a ipsum integer a nibh in quis
9825,9916,2018-05-11 14:15:29,at nulla suspendisse potenti
9825,6800,2018-05-21 08:41:01,eu mi nulla ac enim in
774,571,2018-03-04 20:05:03,odio cras mi
774,90,2018-02-07 15:20:08,ut massa volutpat convallis morbi odio odio elementum eu interdum
774,1201,2018-10-23 07:01:45,dapibus augue vel
774,3242,2018-12-12 13:18:13,neque duis bibendum morbi non quam
774,2441,2018-11-16 22:56:52,molestie sed justo pellentesque
