UserID_1,UserID_2,Date_Time,Message
660,3774,2019-08-21 02:48:39,vivamus vel nulla eget eros elementum pellentesque quisque porta
660,3775,2018-10-28 12:31:05,rutrum ac lobortis vel dapibus at
660,3776,2019-04-01 05:14:16,orci vehicula condimentum curabitur in libero ut massa volutpat
660,747,2019-05-24 14:50:55,amet consectetuer adipiscing elit proin risus praesent lectus vestibulum
1037,1147,2019-02-13 21:28:27,imperdiet sapien urna pretium nisl ut volutpat sapien
1037,1349,2018-12-13 16:13:33,sit amet cursus id
1037,242,2019-09-27 17:56:00,vivamus tortor duis mattis egestas metus aenean fermentum
1037,3780,2018-11-22 11:47:29,venenatis lacinia aenean sit amet
1037,1148,2019-01-17 19:33:17,tellus nulla
1037,1152,2019-04-06 08:05:22,leo maecenas pulvinar lobortis est phasellus sit amet
1037,1154,2019-08-15 05:07:05,aliquam non mauris morbi non lectus aliquam sit amet
1037,1042,2019-01-08 10:27:52,amet lobortis sapien sapien non mi integer ac
1037,1351,2018-10-02 10:35:20,nonummy integer non velit donec
1037,3781,2019-09-05 08:46:11,aliquam quis turpis eget elit sodales scelerisque mauris
1037,1044,2019-07-10 13:00:17,lorem id ligula suspendisse ornare consequat lectus in est
1037,2689,2018-11-09 21:28:40,elementum nullam varius nulla facilisi cras non velit nec
1037,3782,2018-11-23 04:33:18,non velit donec diam neque vestibulum eget vulputate ut
1037,3034,2019-06-30 10:52:15,dictumst etiam faucibus cursus urna ut tellus nulla ut erat
1037,281,2018-11-26 22:50:41,pede justo eu massa donec dapibus duis at
3783,3785,2019-01-16 22:17:42,integer non velit donec diam
3783,1577,2019-01-10 19:49:46,sagittis nam congue risus semper porta
3783,1579,2019-08-22 15:16:09,pharetra magna vestibulum aliquet ultrices erat tortor sollicitudin mi
3783,280,2018-11-02 08:57:41,sociis natoque penatibus et magnis dis parturient montes nascetur ridiculus
3783,3787,2019-05-10 09:12:28,magna at nunc commodo placerat praesent
3783,3789,2019-01-25 08:36:24,suscipit a feugiat et
3790,3791,2019-03-24 06:01:19,pede justo eu massa donec dapibus duis at velit
3790,1135,2019-08-16 12:55:41,urna ut tellus nulla ut
3790,2069,2019-03-06 15:47:26,congue vivamus metus arcu adipiscing molestie hendrerit at
3790,3793,2018-11-14 15:15:14,sit amet justo morbi ut odio
3795,3796,2019-04-20 13:34:53,integer a nibh in quis
3795,515,2018-10-13 05:20:10,orci vehicula condimentum curabitur in libero ut
3795,1189,2019-03-20 12:01:53,nec euismod scelerisque quam turpis adipiscing
3795,3798,2019-03-05 08:02:25,mattis egestas metus aenean
1014,1012,2019-09-14 08:07:07,sapien urna pretium nisl ut volutpat sapien
1014,680,2018-12-24 05:37:27,in tempus sit amet sem fusce consequat nulla nisl
1014,521,2019-02-15 23:03:09,pede libero quis orci
1014,1194,2018-12-31 05:49:01,id nisl venenatis lacinia aenean sit amet justo
970,971,2019-06-13 11:50:36,nunc proin at turpis a pede posuere
970,3799,2019-08-30 12:14:03,est quam pharetra magna ac consequat
970,7,2019-08-11 12:36:56,in purus eu magna vulputate luctus cum sociis
970,979,2019-09-05 03:21:45,nullam orci pede venenatis non sodales sed tincidunt
168,3783,2018-10-13 10:32:03,felis sed lacus morbi sem mauris laoreet ut
168,3124,2019-07-31 19:42:54,in lacus curabitur at ipsum ac
168,3802,2019-07-18 21:40:55,et tempus semper est quam
168,807,2018-11-05 03:33:09,nulla nisl nunc nisl duis
3801,735,2019-02-28 15:17:02,massa volutpat convallis morbi odio odio elementum eu interdum
3801,3116,2019-01-06 21:44:36,nunc nisl duis bibendum felis sed interdum venenatis
3796,3807,2018-10-04 03:55:39,mi nulla ac enim in
3796,3808,2019-02-15 04:49:03,eu nibh quisque id justo sit
3796,3809,2019-08-08 17:12:39,et commodo vulputate justo in blandit ultrices enim lorem ipsum
3796,3815,2019-09-03 11:17:10,mauris lacinia sapien quis libero
1639,3817,2019-08-25 16:30:01,nullam varius nulla facilisi cras non
1639,1643,2019-01-18 03:20:48,dictumst etiam faucibus cursus urna ut
1639,2552,2018-12-12 14:29:17,non pretium quis lectus suspendisse potenti in eleifend quam
1639,3290,2019-09-22 10:17:38,at turpis a pede posuere nonummy integer non velit donec
1639,3821,2019-07-29 18:26:20,tellus nisi eu orci mauris lacinia sapien quis libero nullam
1639,3828,2018-12-21 12:58:32,nec nisi volutpat eleifend donec ut dolor
1639,3831,2018-10-29 08:31:29,ipsum dolor sit amet consectetuer adipiscing
1639,3756,2019-06-30 13:50:54,at velit vivamus vel nulla eget eros
1639,1896,2018-12-09 04:10:14,ornare imperdiet sapien urna pretium nisl
1639,3833,2019-07-03 08:01:35,feugiat non pretium quis lectus suspendisse potenti in eleifend
634,632,2019-07-01 19:18:14,erat id mauris vulputate elementum nullam varius nulla facilisi
634,446,2018-11-25 03:12:15,dolor vel est donec odio justo sollicitudin
634,2829,2019-07-28 15:59:23,ipsum aliquam non mauris morbi non lectus
634,1042,2019-05-20 13:00:11,porttitor pede justo eu massa
634,3834,2019-08-11 20:27:58,eu orci mauris lacinia
634,3835,2019-07-12 15:25:40,enim leo rhoncus sed vestibulum sit amet cursus id
634,2291,2018-12-03 00:29:41,orci luctus et ultrices posuere cubilia curae nulla dapibus
3840,3842,2019-05-04 01:20:23,non mattis pulvinar nulla pede ullamcorper
3840,3843,2019-05-21 07:32:26,in est risus auctor sed tristique in tempus sit
3840,3844,2018-12-23 05:26:28,fusce lacus purus aliquet at feugiat non pretium
3840,3847,2019-07-08 01:36:30,varius ut blandit non interdum in ante vestibulum
3840,3848,2019-03-28 09:48:08,mi integer ac neque duis bibendum morbi non quam
3851,3853,2019-02-02 16:01:37,mi integer ac neque duis bibendum morbi non
3841,3854,2019-02-15 21:12:59,etiam pretium iaculis justo in hac habitasse platea dictumst
3841,3857,2019-01-04 23:14:49,est congue elementum in hac habitasse platea
455,3858,2018-10-01 00:30:50,ultrices mattis odio donec vitae
455,698,2018-12-15 15:33:30,congue eget semper rutrum nulla nunc purus phasellus in
455,1140,2019-06-30 02:51:01,mattis pulvinar nulla pede ullamcorper augue a suscipit
3861,3864,2018-11-28 17:42:09,erat quisque erat eros viverra eget congue eget semper
3842,1041,2019-09-08 19:38:45,dui nec nisi volutpat eleifend donec ut dolor morbi vel
3842,3867,2019-04-13 06:58:03,in hac habitasse platea
3842,3411,2019-07-11 22:40:48,suspendisse accumsan tortor quis turpis sed
3842,3873,2019-04-28 00:19:48,tristique in tempus sit amet sem fusce
3842,3875,2018-12-30 18:45:15,congue elementum in hac habitasse platea dictumst morbi
3842,3877,2019-05-10 08:49:51,eget rutrum at lorem integer tincidunt ante vel ipsum praesent
3842,3882,2019-05-14 06:21:49,eget tempus vel pede morbi porttitor
3842,2315,2019-08-14 12:39:08,nec molestie sed justo pellentesque viverra pede ac diam
3842,3886,2019-06-22 11:04:05,velit eu est congue elementum in hac habitasse platea
3842,3891,2019-04-30 10:33:40,quis tortor id nulla ultrices aliquet maecenas
3842,3897,2018-11-25 13:54:20,pede lobortis ligula sit amet eleifend pede libero quis orci
3842,3903,2019-02-25 13:25:17,in lectus pellentesque at
3842,3904,2019-02-23 17:49:42,morbi sem mauris laoreet ut rhoncus
3842,3907,2019-08-12 07:29:26,nec molestie sed justo
3842,3908,2019-05-23 19:45:43,et magnis dis parturient montes nascetur ridiculus mus etiam vel
3842,3911,2018-12-05 17:06:55,nec dui luctus rutrum nulla tellus in sagittis dui
3842,3912,2019-07-29 00:58:36,interdum mauris non ligula pellentesque ultrices
3842,3913,2019-04-11 04:51:31,sit amet turpis elementum ligula vehicula consequat morbi
3842,3914,2018-11-27 03:31:31,magnis dis parturient montes nascetur ridiculus mus vivamus vestibulum
3842,3915,2019-01-19 18:34:52,sit amet justo morbi ut odio
3842,3917,2019-09-12 20:39:14,vivamus tortor duis mattis egestas metus aenean fermentum donec ut
3842,3919,2019-01-31 13:22:28,sapien placerat ante nulla
3842,3926,2018-11-13 13:59:57,ut volutpat sapien arcu
3842,3927,2019-07-22 06:11:52,dis parturient montes nascetur ridiculus
3842,3929,2019-05-24 19:50:44,arcu adipiscing molestie hendrerit at vulputate vitae nisl aenean
3842,3931,2019-02-21 01:26:24,amet erat nulla tempus vivamus in felis eu sapien cursus
3842,3934,2019-06-24 20:52:57,donec diam neque vestibulum eget vulputate ut ultrices
3842,3938,2019-08-18 12:38:29,vivamus vestibulum sagittis sapien cum sociis natoque penatibus
3842,1103,2019-02-25 18:03:31,venenatis non sodales sed tincidunt eu felis
3842,3939,2019-06-13 01:05:02,ornare consequat lectus in est risus auctor
3842,3940,2018-11-12 13:09:55,rutrum ac lobortis vel dapibus at diam nam tristique
3842,3947,2019-05-14 08:18:47,mi nulla ac enim
3842,3950,2018-12-09 20:00:32,in tempus sit amet
3842,3951,2019-01-31 10:23:46,quisque arcu libero rutrum ac lobortis vel dapibus at diam
3842,3953,2018-11-15 06:34:23,nullam porttitor lacus at turpis donec posuere
3842,3955,2019-08-01 23:30:41,metus aenean fermentum donec ut
3842,3956,2018-11-25 15:45:43,ipsum integer a nibh in quis justo maecenas rhoncus aliquam
3842,3961,2019-05-26 20:43:08,commodo vulputate justo in
3842,3962,2019-07-20 00:12:13,ut volutpat sapien arcu sed augue aliquam erat
3842,3963,2018-10-30 12:44:23,in magna bibendum imperdiet nullam orci pede
3964,3965,2018-12-15 08:05:37,augue vel accumsan tellus nisi eu orci mauris
3966,3971,2019-03-03 02:59:18,id lobortis convallis tortor risus dapibus augue vel
3972,3974,2018-10-31 10:43:24,erat nulla tempus vivamus
3972,3976,2018-11-20 10:44:31,risus auctor sed tristique in tempus sit amet sem
3972,3423,2019-02-23 23:11:43,in faucibus orci luctus
3972,3979,2018-12-06 04:20:06,enim blandit mi in porttitor pede
3972,3983,2019-09-06 11:59:24,tempus semper est quam pharetra
3972,3984,2019-02-28 12:33:19,suspendisse potenti in eleifend quam a
3972,3985,2019-09-04 04:07:47,mattis odio donec vitae nisi nam ultrices
3972,3986,2019-04-07 16:39:49,lobortis ligula sit amet
3972,3987,2018-10-23 00:36:41,nisl venenatis lacinia aenean sit amet justo morbi ut odio
3972,3988,2019-08-30 16:12:50,vestibulum vestibulum ante ipsum primis in faucibus orci luctus
3972,3990,2018-10-08 07:14:49,proin at turpis a pede posuere nonummy integer non
3972,3991,2019-05-06 13:44:14,nisi at nibh in hac habitasse platea
3972,3992,2019-04-14 15:39:13,magna vestibulum aliquet ultrices erat
3972,3993,2019-08-19 20:37:18,consequat metus sapien ut nunc vestibulum ante ipsum primis in
3972,3995,2018-10-04 05:05:17,tincidunt eget tempus vel pede morbi porttitor lorem id ligula
3972,3996,2019-05-23 19:35:39,pellentesque eget nunc donec
3972,3999,2019-01-31 03:37:06,pede ac diam cras pellentesque volutpat
3972,1103,2019-03-03 06:53:24,pellentesque at nulla suspendisse potenti cras
3972,2352,2018-12-31 11:02:30,in faucibus orci luctus
3972,4004,2019-09-11 20:39:51,amet erat nulla tempus vivamus in felis eu sapien cursus
3972,4006,2019-07-02 08:58:55,sapien sapien non mi integer ac neque duis bibendum
3972,4011,2018-10-28 01:33:47,elementum ligula vehicula consequat morbi a ipsum
34,4014,2019-08-02 15:17:50,luctus ultricies eu nibh quisque id justo sit amet sapien
34,4015,2019-09-18 04:48:48,justo sit amet sapien dignissim vestibulum vestibulum ante ipsum
34,4022,2019-01-17 23:41:29,integer tincidunt ante vel ipsum praesent blandit lacinia
3355,4024,2019-03-06 02:28:10,ut erat id mauris vulputate elementum nullam
3355,4025,2019-03-03 07:15:34,nec sem duis aliquam convallis nunc proin at turpis
3355,4027,2019-05-22 09:42:23,est donec odio justo
3355,4028,2019-04-07 02:53:17,in sapien iaculis congue
3355,3361,2019-02-06 14:23:52,tincidunt eget tempus vel pede morbi porttitor
4029,4032,2019-04-28 01:47:46,in faucibus orci luctus et
4029,4033,2018-12-17 18:46:36,vehicula consequat morbi a ipsum
4029,4034,2019-03-31 17:35:11,non sodales sed tincidunt eu
4029,4037,2019-07-09 22:04:19,ac nulla sed vel enim sit amet nunc viverra dapibus
4029,4038,2019-09-14 16:54:28,vel accumsan tellus nisi eu orci mauris lacinia sapien
4029,2606,2019-08-17 17:53:52,et ultrices posuere cubilia
4029,1930,2019-04-11 18:02:51,pellentesque eget nunc donec quis orci eget orci vehicula condimentum
169,179,2018-10-14 00:30:25,ligula nec sem duis aliquam convallis nunc proin at
169,185,2019-01-20 17:55:13,eu magna vulputate luctus cum
169,189,2019-07-24 12:14:33,ut volutpat sapien arcu sed augue aliquam erat volutpat in
4048,4050,2019-02-16 18:41:41,blandit ultrices enim lorem ipsum dolor sit amet consectetuer adipiscing
4048,4053,2019-01-25 08:37:07,mi sit amet lobortis sapien sapien non mi
972,968,2019-04-06 12:47:40,luctus et ultrices posuere cubilia curae
972,969,2019-08-04 17:31:05,ultricies eu nibh quisque id justo sit amet sapien dignissim
972,1280,2019-02-05 06:45:13,faucibus orci luctus et ultrices posuere
972,977,2019-07-07 01:24:42,congue risus semper porta volutpat quam pede lobortis
972,978,2019-03-16 14:36:20,quam sapien varius ut blandit non interdum in ante
972,736,2018-11-25 08:02:56,blandit ultrices enim lorem ipsum dolor sit amet
4060,4062,2019-02-06 08:20:35,urna ut tellus nulla ut erat id
4060,4063,2019-02-09 09:34:52,vestibulum ante ipsum primis in faucibus orci luctus et ultrices
4055,4067,2018-12-18 19:07:20,quam sapien varius ut
2626,1172,2019-03-05 21:18:26,vestibulum vestibulum ante ipsum primis in faucibus orci luctus
2626,4074,2019-09-22 00:42:40,amet nunc viverra dapibus nulla
973,4055,2019-04-03 11:58:24,tellus nisi eu orci mauris lacinia
973,735,2019-04-03 13:31:33,gravida nisi at nibh in
973,4035,2018-12-14 03:57:51,tempus vivamus in felis eu sapien cursus vestibulum
973,980,2019-06-13 23:20:22,eget orci vehicula condimentum
973,1537,2019-08-04 14:37:59,in congue etiam justo etiam pretium
4076,4077,2019-02-13 22:16:33,pulvinar sed nisl nunc rhoncus
4076,4079,2019-09-08 14:01:19,tellus nisi eu orci mauris lacinia sapien quis libero nullam
4076,2952,2019-09-02 00:22:07,lorem ipsum dolor sit amet consectetuer adipiscing elit
4076,4083,2018-10-31 20:54:03,tortor duis mattis egestas metus aenean fermentum donec ut mauris
4045,4085,2019-09-25 16:27:41,porta volutpat quam pede lobortis ligula sit
4045,4086,2019-09-29 05:31:27,eget eleifend luctus ultricies
4045,4087,2019-04-21 20:17:14,viverra pede ac diam
4045,4091,2018-11-30 19:17:45,augue quam sollicitudin vitae consectetuer eget rutrum at
4045,4093,2019-04-25 07:15:43,in faucibus orci luctus et ultrices posuere cubilia curae duis
4097,4099,2019-08-17 11:10:52,vel ipsum praesent blandit lacinia erat vestibulum sed magna at
974,968,2018-10-31 23:43:38,id turpis integer aliquet massa id lobortis convallis
974,976,2019-09-16 14:49:26,pellentesque ultrices mattis odio donec
974,978,2018-12-18 03:45:47,eget nunc donec quis orci eget orci
974,3863,2019-03-02 17:49:43,eros viverra eget congue eget semper rutrum
305,1689,2019-04-22 02:33:46,augue quam sollicitudin vitae
305,2141,2019-07-27 12:19:53,tempus semper est quam pharetra magna ac consequat metus
305,3105,2019-06-10 18:26:09,pellentesque ultrices phasellus id sapien
305,4103,2019-07-08 03:16:35,sed lacus morbi sem mauris laoreet
305,2158,2018-11-10 09:05:22,sagittis dui vel nisl duis ac
305,337,2018-12-26 16:12:04,molestie sed justo pellentesque viverra pede
4105,4106,2019-08-01 13:53:14,lobortis ligula sit amet eleifend pede libero quis orci nullam
4105,4108,2019-07-01 12:24:09,tortor sollicitudin mi sit amet lobortis
4105,4110,2019-08-11 23:01:56,orci nullam molestie nibh in lectus pellentesque at nulla suspendisse
4112,4113,2019-03-10 13:54:01,convallis eget eleifend luctus
4112,4114,2019-07-08 11:05:13,sed accumsan felis ut at dolor
1260,572,2019-06-15 18:14:37,pellentesque viverra pede ac
1260,4118,2019-03-08 01:06:05,ullamcorper purus sit amet
1260,4119,2019-03-28 14:18:52,aliquet ultrices erat tortor sollicitudin mi sit
1260,1262,2019-03-04 14:51:28,convallis duis consequat dui
1260,4120,2019-04-28 09:23:20,amet nunc viverra dapibus
1260,4121,2019-06-25 01:58:34,dignissim vestibulum vestibulum ante
1260,4122,2019-06-14 19:08:12,malesuada in imperdiet et commodo
1260,4125,2018-12-26 18:29:45,varius integer ac leo pellentesque ultrices mattis odio
1260,4127,2018-10-17 01:01:52,risus praesent lectus vestibulum quam sapien
1260,4130,2019-09-21 18:22:43,habitasse platea dictumst maecenas ut massa
2252,2120,2018-12-06 09:12:05,lacinia eget tincidunt eget tempus vel
2252,2725,2018-10-15 13:01:55,dolor sit amet consectetuer adipiscing elit proin risus praesent
2252,2136,2019-05-20 10:41:50,vel nulla eget eros elementum pellentesque quisque porta volutpat
2252,2255,2018-12-24 02:44:43,risus semper porta volutpat
2252,2640,2019-05-20 17:08:06,ut odio cras mi
2252,3105,2018-10-07 10:09:57,molestie sed justo pellentesque viverra
2252,2155,2019-05-13 13:30:56,ligula in lacus curabitur at ipsum ac tellus semper interdum
2252,4132,2018-12-10 03:42:55,fermentum justo nec condimentum neque sapien placerat ante nulla justo
2252,2268,2018-11-18 03:15:48,odio consequat varius integer ac leo pellentesque ultrices mattis
2829,254,2019-04-01 02:07:32,metus aenean fermentum donec
2829,1135,2019-08-23 22:38:26,id ornare imperdiet sapien urna
2829,1891,2019-07-06 12:55:21,ultrices posuere cubilia curae duis
2829,1381,2019-01-16 14:09:43,id mauris vulputate elementum nullam varius nulla facilisi cras non
2829,4140,2019-04-18 07:23:26,lectus suspendisse potenti in eleifend quam
2829,23,2019-07-27 11:06:43,nulla ut erat id mauris vulputate
2829,2868,2018-10-12 06:45:56,massa donec dapibus duis at velit
2829,4142,2019-07-01 04:21:23,sed magna at nunc commodo placerat praesent blandit
2829,2576,2019-05-10 21:37:48,vitae consectetuer eget rutrum at lorem integer tincidunt
2829,706,2018-12-04 01:04:55,elementum pellentesque quisque porta volutpat erat quisque
2829,4144,2019-06-28 17:26:27,vestibulum velit id pretium iaculis diam erat fermentum
2829,4147,2019-01-19 12:09:05,enim in tempor turpis nec
2829,4148,2019-09-01 18:52:23,mattis egestas metus aenean fermentum donec ut mauris eget massa
2829,4149,2018-11-28 00:50:30,hac habitasse platea dictumst maecenas ut massa
375,373,2019-03-13 20:19:36,rhoncus dui vel sem sed sagittis nam congue
375,3463,2019-02-04 17:40:10,a nibh in quis justo maecenas rhoncus aliquam lacus morbi
375,2271,2018-12-24 15:49:16,odio elementum eu interdum eu tincidunt in leo maecenas
375,380,2019-08-17 20:09:58,id mauris vulputate elementum nullam varius nulla
375,3475,2018-11-25 17:04:14,sit amet nulla quisque arcu libero
375,2274,2019-08-20 02:37:09,aenean fermentum donec ut mauris eget massa tempor convallis nulla
375,4154,2019-08-23 10:58:06,sollicitudin mi sit amet lobortis sapien sapien non
375,3822,2019-02-16 03:21:56,nunc nisl duis bibendum felis sed interdum venenatis turpis enim
375,4158,2018-12-03 10:01:20,vitae ipsum aliquam non mauris morbi non lectus aliquam sit
375,4159,2019-04-13 19:43:09,ligula nec sem duis aliquam convallis nunc
375,400,2019-01-25 18:51:33,posuere metus vitae ipsum aliquam non mauris morbi non lectus
375,404,2019-08-26 00:09:10,integer pede justo lacinia
375,803,2019-05-05 12:30:13,leo rhoncus sed vestibulum sit amet cursus id turpis integer
375,407,2018-12-25 00:39:55,adipiscing elit proin risus praesent lectus
375,2288,2019-02-04 13:27:10,pellentesque ultrices mattis odio donec
375,4168,2019-01-02 23:05:56,ut dolor morbi vel lectus in
3464,4170,2019-09-06 08:21:32,rhoncus aliquam lacus morbi
3464,4171,2018-10-24 17:42:17,sed lacus morbi sem mauris laoreet ut rhoncus aliquet pulvinar
3464,4172,2019-07-21 00:00:35,consequat ut nulla sed accumsan felis
3464,382,2019-03-23 03:22:49,proin eu mi nulla ac enim in
3464,4154,2019-07-20 15:56:22,venenatis non sodales sed tincidunt eu felis fusce posuere felis
3464,3822,2019-03-10 21:29:28,ac lobortis vel dapibus at diam nam
3464,4155,2019-08-21 04:57:08,amet nunc viverra dapibus nulla suscipit ligula in lacus curabitur
3464,4186,2018-11-20 15:58:35,sollicitudin mi sit amet lobortis sapien sapien non
3464,4190,2019-02-10 15:29:31,odio elementum eu interdum eu tincidunt
3464,4195,2019-02-05 14:49:26,ipsum ac tellus semper interdum mauris ullamcorper
3464,4196,2019-07-04 18:39:24,nec molestie sed justo pellentesque viverra pede
4197,4198,2019-02-09 04:42:06,quam turpis adipiscing lorem vitae
4197,4200,2019-07-26 04:17:44,lacus at velit vivamus
4197,3116,2018-11-10 15:29:41,curae duis faucibus accumsan odio
4197,4201,2018-11-16 17:54:55,integer a nibh in quis justo maecenas
4197,2951,2019-01-22 23:41:09,sapien non mi integer ac neque duis bibendum morbi non
2961,2822,2018-10-22 14:30:48,lorem quisque ut erat curabitur gravida nisi at nibh
2961,4206,2019-02-12 14:01:37,at nunc commodo placerat praesent blandit nam
2961,2964,2018-10-25 04:54:46,justo in hac habitasse platea dictumst etiam faucibus
92,89,2019-08-03 04:22:08,lacus at turpis donec posuere
92,1200,2019-05-05 20:52:27,molestie hendrerit at vulputate vitae
92,515,2019-01-04 06:54:23,quam sapien varius ut blandit non interdum
92,774,2019-04-20 06:40:33,etiam pretium iaculis justo in hac habitasse platea dictumst
92,1189,2019-06-15 22:13:04,tristique in tempus sit amet sem fusce consequat nulla nisl
92,574,2019-05-13 20:49:25,ligula in lacus curabitur at ipsum ac
92,1712,2018-11-25 09:41:31,lectus pellentesque eget nunc donec
92,428,2019-09-17 04:10:21,mattis nibh ligula nec
92,102,2019-04-17 10:17:35,blandit nam nulla integer pede justo lacinia eget
92,782,2018-10-24 11:23:14,rutrum ac lobortis vel dapibus at diam nam tristique tortor
92,108,2019-05-08 12:52:30,neque vestibulum eget vulputate ut
92,786,2019-08-17 17:20:56,ipsum ac tellus semper interdum mauris ullamcorper
92,123,2019-04-30 02:19:16,est congue elementum in hac habitasse platea dictumst morbi
92,791,2019-03-20 19:08:30,nisl venenatis lacinia aenean sit
92,432,2019-06-10 06:22:49,ullamcorper augue a suscipit nulla elit ac nulla sed
92,146,2018-11-02 11:37:43,laoreet ut rhoncus aliquet pulvinar
92,610,2019-05-01 19:40:26,ut volutpat sapien arcu sed augue
92,809,2018-10-31 21:22:11,mauris ullamcorper purus sit amet nulla quisque arcu libero
239,234,2019-09-25 00:01:20,massa volutpat convallis morbi odio odio elementum eu interdum eu
239,1173,2019-03-09 00:15:43,non mattis pulvinar nulla pede
239,238,2019-06-05 04:47:42,aliquam non mauris morbi non lectus aliquam sit amet diam
239,241,2019-07-25 23:42:18,id turpis integer aliquet massa
239,170,2019-03-18 10:14:11,adipiscing lorem vitae mattis nibh ligula nec sem duis
239,740,2019-03-24 22:00:39,habitasse platea dictumst morbi vestibulum velit id pretium
239,2814,2018-10-20 12:49:32,platea dictumst aliquam augue
239,2074,2019-06-17 13:39:44,dis parturient montes nascetur
239,3154,2019-07-15 07:58:05,magna at nunc commodo
239,4212,2019-05-28 08:35:50,lacinia nisi venenatis tristique fusce
239,1128,2019-02-02 03:14:13,nulla eget eros elementum pellentesque quisque
239,261,2019-01-14 07:27:14,ullamcorper purus sit amet nulla quisque arcu libero rutrum
239,263,2018-10-11 16:37:06,molestie sed justo pellentesque viverra pede ac
239,278,2019-07-01 07:08:57,quis turpis sed ante vivamus tortor duis mattis egestas
239,2178,2018-12-13 00:35:50,aenean fermentum donec ut mauris eget massa
2123,2117,2019-08-24 10:05:42,cras mi pede malesuada
814,1637,2019-05-02 04:39:30,quisque id justo sit amet sapien
814,244,2019-08-05 11:11:09,massa tempor convallis nulla neque libero convallis eget eleifend
814,815,2019-09-27 08:00:18,gravida sem praesent id massa id nisl venenatis lacinia
814,877,2019-01-29 23:54:19,nunc commodo placerat praesent blandit nam nulla integer
814,15,2018-10-25 20:39:04,sapien arcu sed augue aliquam erat volutpat in congue etiam
814,4221,2019-08-08 13:36:12,molestie sed justo pellentesque viverra pede ac diam cras pellentesque
814,22,2019-07-22 09:04:22,proin eu mi nulla ac
814,1095,2018-10-13 18:31:49,aliquam quis turpis eget elit sodales scelerisque mauris
814,2866,2019-01-26 10:50:43,semper rutrum nulla nunc purus phasellus in felis donec semper
814,821,2019-07-12 23:25:47,erat id mauris vulputate elementum nullam varius
814,4222,2019-07-11 22:36:00,vestibulum ante ipsum primis
814,842,2019-04-30 06:46:43,vestibulum ante ipsum primis in faucibus orci
814,2546,2018-11-03 16:18:49,felis sed interdum venenatis turpis enim blandit mi in
814,4227,2018-10-13 01:00:29,diam id ornare imperdiet sapien
814,27,2019-07-26 04:32:27,feugiat non pretium quis lectus
814,2550,2019-03-16 23:28:17,consequat ut nulla sed accumsan felis ut
2637,2640,2018-11-14 14:11:58,venenatis turpis enim blandit
240,1146,2019-02-07 11:02:51,ac est lacinia nisi venenatis tristique fusce
240,1037,2019-02-08 12:23:51,nulla integer pede justo lacinia eget tincidunt
240,1349,2018-10-28 23:32:45,dapibus augue vel accumsan tellus nisi eu orci
240,1152,2019-02-06 07:46:22,sapien quis libero nullam sit
240,1153,2018-11-07 15:06:32,quis odio consequat varius
240,1351,2019-03-26 06:03:11,suspendisse potenti in eleifend quam a
240,1155,2019-02-01 20:01:20,scelerisque quam turpis adipiscing lorem vitae mattis nibh ligula
240,250,2019-06-01 01:44:45,orci mauris lacinia sapien quis libero nullam sit
4235,4236,2019-09-24 15:18:35,placerat ante nulla justo aliquam
4235,4238,2019-07-19 02:08:35,enim leo rhoncus sed
4235,2524,2018-11-02 05:51:13,sit amet consectetuer adipiscing elit proin
4235,872,2019-07-26 13:23:36,eros viverra eget congue eget semper rutrum nulla nunc
4235,265,2019-02-05 16:17:40,amet cursus id turpis integer aliquet
4235,4239,2018-11-13 11:51:11,id nisl venenatis lacinia aenean sit amet justo
4235,4242,2019-05-07 16:16:14,risus auctor sed tristique
4235,2926,2019-09-14 13:00:07,ornare imperdiet sapien urna
4235,4247,2018-12-09 15:50:26,pellentesque ultrices phasellus id sapien in sapien iaculis congue vivamus
4235,4248,2018-10-09 14:28:05,hac habitasse platea dictumst morbi vestibulum
4235,4250,2019-07-18 08:28:25,in quis justo maecenas
