UserID_1,UserID_2,Date_Time,Message
1,2,2018-12-27 11:36:41,risus semper porta volutpat quam pede lobortis ligula sit amet eleifend pede
1,5,2018-10-12 03:12:01,lectus pellentesque eget nunc donec quis orci eget orci vehicula condimentum
1,9,2018-10-18 23:26:43,iaculis diam erat fermentum justo nec condimentum neque sapien
1,16,2018-12-29 08:33:17,morbi a ipsum
1,20,2019-01-04 16:11:44,erat vestibulum sed magna at nunc commodo placerat praesent blandit
1,22,2019-07-18 21:33:00,nunc commodo placerat praesent blandit nam nulla integer
1,23,2019-06-23 23:16:01,lacus morbi sem mauris laoreet ut rhoncus aliquet pulvinar sed nisl nunc rhoncus dui
28,30,2019-04-15 04:24:50,augue vestibulum ante ipsum primis in
28,31,2019-09-12 09:35:43,vel augue vestibulum rutrum rutrum neque aenean
32,34,2018-10-23 12:23:00,felis eu sapien cursus vestibulum proin eu mi nulla ac enim in tempor turpis nec
38,47,2018-11-11 09:00:07,venenatis turpis enim blandit mi in porttitor pede justo eu massa donec dapibus
38,49,2018-10-10 01:38:08,lectus aliquam sit
50,51,2019-08-01 12:39:46,justo sit amet sapien dignissim vestibulum vestibulum ante ipsum primis in faucibus
50,7,2019-01-28 08:40:47,felis eu sapien cursus vestibulum proin eu mi nulla ac
58,62,2018-12-06 20:46:39,quis turpis sed ante vivamus
58,63,2018-12-03 14:20:43,in faucibus orci luctus et
64,65,2018-12-24 05:52:38,pede justo eu massa donec dapibus duis at velit eu
64,70,2019-02-08 15:04:36,sapien a libero nam dui proin leo odio porttitor id consequat in
73,75,2019-03-09 04:18:43,ac nibh fusce lacus purus aliquet at feugiat
73,76,2019-08-30 06:29:07,consequat in consequat ut nulla sed accumsan felis ut at dolor
73,80,2019-07-22 06:56:23,mauris viverra diam vitae quam suspendisse potenti nullam porttitor lacus
73,81,2019-03-16 21:34:48,eros suspendisse accumsan tortor quis turpis sed ante vivamus tortor duis mattis
73,84,2019-02-06 07:44:32,sapien dignissim vestibulum vestibulum ante ipsum primis in faucibus orci luctus
73,85,2019-02-19 14:11:03,praesent blandit nam nulla integer pede justo lacinia eget tincidunt eget tempus vel pede morbi
86,88,2019-05-25 11:22:56,tincidunt eu felis fusce posuere felis sed lacus
86,92,2019-04-23 17:29:52,venenatis lacinia aenean sit amet justo
86,97,2019-10-04 08:46:22,viverra dapibus nulla suscipit ligula in lacus curabitur at ipsum ac tellus
86,101,2018-12-25 02:38:56,lobortis est phasellus sit amet erat nulla tempus vivamus in felis
86,103,2019-02-07 10:47:30,sit amet consectetuer adipiscing
86,105,2019-09-05 11:06:13,odio donec vitae nisi
86,110,2018-11-10 09:49:59,magna ac consequat metus sapien ut nunc vestibulum ante ipsum primis in faucibus orci
86,113,2019-04-20 13:57:10,odio donec vitae
86,116,2018-11-07 07:18:09,nulla justo aliquam quis turpis eget elit
86,119,2019-05-24 17:27:46,suscipit nulla elit ac nulla sed vel enim sit amet nunc viverra dapibus nulla
86,123,2019-06-04 20:43:02,maecenas rhoncus aliquam lacus morbi quis tortor id nulla ultrices
86,128,2019-05-11 12:52:28,sit amet nulla quisque arcu libero rutrum ac lobortis vel
86,130,2019-07-30 01:36:44,in blandit ultrices enim lorem ipsum dolor sit amet consectetuer adipiscing elit proin interdum
86,132,2018-11-21 23:36:13,suscipit a feugiat et eros vestibulum ac est
86,135,2018-11-21 22:00:47,maecenas pulvinar lobortis est
86,138,2019-01-22 08:13:27,sem sed sagittis nam congue risus semper porta volutpat quam pede lobortis ligula sit amet
86,139,2018-11-09 00:47:16,libero quis orci nullam molestie nibh
86,142,2019-01-09 11:23:44,blandit mi in porttitor pede justo eu
86,146,2019-09-15 20:27:40,sit amet consectetuer adipiscing elit proin risus praesent lectus
86,148,2018-10-27 13:45:56,donec posuere metus vitae ipsum aliquam non mauris morbi non
86,149,2019-01-29 19:46:44,vel enim sit amet nunc viverra
86,150,2019-08-05 03:28:23,vel sem sed sagittis nam congue risus semper porta volutpat quam pede
86,154,2019-09-13 17:45:12,neque duis bibendum morbi non quam nec dui luctus rutrum
86,160,2019-04-12 21:09:36,rutrum ac lobortis vel dapibus at
161,163,2018-10-19 13:25:35,aliquet maecenas leo odio condimentum id luctus nec molestie sed justo pellentesque viverra pede ac
161,33,2019-10-06 07:43:18,viverra dapibus nulla suscipit ligula in lacus curabitur at ipsum ac tellus
161,167,2018-10-09 04:01:54,nibh fusce lacus purus aliquet at feugiat non pretium
161,175,2019-09-26 06:59:08,aliquam convallis nunc proin at turpis a pede posuere nonummy integer non velit donec diam
161,177,2018-10-25 16:20:57,dis parturient montes nascetur ridiculus mus etiam vel
161,178,2019-01-17 03:24:42,consequat morbi a ipsum integer a nibh in quis justo maecenas rhoncus aliquam lacus
161,182,2019-08-22 07:17:22,congue vivamus metus arcu adipiscing molestie hendrerit at vulputate vitae nisl aenean lectus
161,183,2018-10-22 09:48:30,in hac habitasse platea dictumst aliquam augue quam sollicitudin vitae consectetuer eget rutrum at lorem
161,184,2019-03-04 09:44:53,justo eu massa donec dapibus duis
161,187,2018-12-04 10:08:28,tristique est et tempus semper est quam pharetra magna ac consequat
161,37,2018-11-24 17:35:14,duis aliquam convallis nunc proin at turpis a pede posuere
161,21,2019-07-18 01:59:26,aliquet at feugiat non pretium quis lectus suspendisse potenti in eleifend quam
161,191,2019-01-13 19:18:55,tincidunt in leo maecenas pulvinar lobortis est
161,192,2019-05-18 17:16:08,quisque ut erat curabitur gravida
161,198,2019-08-02 00:28:23,nunc vestibulum ante ipsum primis
161,205,2019-04-18 05:01:59,feugiat non pretium quis lectus suspendisse potenti in eleifend
208,210,2019-10-04 07:49:36,lobortis est phasellus sit amet erat nulla tempus vivamus in felis eu
208,214,2019-04-13 15:09:03,ligula sit amet eleifend pede libero quis
208,215,2019-05-31 06:24:06,diam in magna bibendum imperdiet nullam orci pede venenatis non sodales sed tincidunt eu
208,216,2019-04-06 14:49:31,nunc nisl duis bibendum felis sed interdum venenatis turpis enim blandit mi in
208,218,2018-10-28 13:31:13,viverra dapibus nulla suscipit ligula in lacus curabitur at ipsum ac tellus semper interdum mauris
219,222,2018-12-19 00:49:07,pede lobortis ligula sit amet eleifend pede libero quis orci nullam molestie nibh
219,226,2019-03-28 15:18:12,accumsan felis ut at dolor quis odio consequat varius integer ac
219,230,2019-04-09 04:30:53,pretium nisl ut volutpat sapien arcu sed augue aliquam erat volutpat
232,237,2019-09-10 02:58:56,ultricies eu nibh quisque id justo sit amet sapien dignissim vestibulum vestibulum ante
232,240,2019-09-24 12:29:17,ultrices mattis odio donec vitae nisi nam ultrices
232,244,2018-12-05 00:52:53,nulla ultrices aliquet maecenas leo odio condimentum id luctus nec molestie sed justo
232,250,2018-10-13 07:03:54,in tempor turpis
232,253,2019-06-26 08:55:47,a pede posuere nonummy integer non velit donec
232,258,2018-11-25 20:02:36,porttitor id consequat in consequat ut
232,259,2019-02-21 00:12:59,cras pellentesque volutpat dui maecenas
232,262,2019-03-28 08:43:32,rhoncus sed vestibulum sit amet cursus id turpis integer aliquet massa id lobortis convallis
232,266,2019-01-14 05:47:14,neque libero convallis eget eleifend
232,268,2019-04-15 08:27:03,dolor quis odio consequat varius integer ac leo pellentesque ultrices mattis odio
232,269,2019-01-29 06:26:09,felis ut at dolor quis odio consequat
232,270,2019-07-27 12:57:03,amet eros suspendisse accumsan tortor quis turpis sed ante vivamus tortor duis mattis egestas
232,277,2019-04-05 12:24:06,curae mauris viverra diam vitae quam suspendisse potenti nullam porttitor lacus at
232,278,2019-06-27 17:38:08,justo sollicitudin ut
282,284,2018-10-27 08:19:39,euismod scelerisque quam turpis adipiscing lorem vitae mattis nibh ligula
282,288,2018-10-20 15:40:59,etiam justo etiam pretium iaculis justo in hac habitasse platea dictumst
282,289,2019-04-26 11:30:34,et magnis dis parturient montes nascetur ridiculus mus etiam vel augue
282,290,2019-08-06 01:59:02,montes nascetur ridiculus mus etiam vel augue vestibulum rutrum rutrum neque
162,297,2018-11-28 05:44:19,lectus in quam fringilla rhoncus mauris enim leo
162,300,2018-11-25 17:55:56,eleifend donec ut dolor morbi vel lectus in quam fringilla rhoncus mauris enim
303,306,2018-10-29 01:54:22,justo eu massa
303,308,2019-08-17 07:04:10,quisque ut erat curabitur gravida nisi at nibh in hac
303,310,2019-01-11 12:49:19,sapien arcu sed augue aliquam erat volutpat in congue etiam justo etiam pretium iaculis
303,315,2019-07-21 07:09:25,vel nisl duis ac nibh fusce lacus purus aliquet at feugiat non pretium quis lectus
303,316,2019-09-01 07:46:29,ante ipsum primis in faucibus
303,317,2019-04-18 08:46:02,ligula suspendisse ornare
303,322,2019-06-10 19:04:16,morbi quis tortor id nulla ultrices aliquet maecenas leo odio condimentum id
303,330,2018-10-18 03:19:05,quis lectus suspendisse
303,334,2019-05-30 08:28:23,pretium quis lectus suspendisse potenti
303,335,2019-04-01 07:56:36,mollis molestie lorem quisque ut erat curabitur gravida nisi at nibh in hac habitasse platea
303,339,2019-03-20 08:56:47,lectus pellentesque at nulla suspendisse potenti cras in purus eu magna vulputate luctus
303,340,2018-12-20 12:59:14,sit amet eleifend pede libero quis orci nullam molestie nibh in lectus pellentesque at nulla
303,346,2019-03-13 08:51:49,semper sapien a libero nam dui proin leo odio porttitor id consequat in consequat ut
303,350,2019-03-18 15:51:16,euismod scelerisque quam turpis adipiscing lorem vitae mattis
303,354,2019-09-13 18:18:55,sit amet justo morbi ut odio cras mi pede malesuada in imperdiet et commodo vulputate
303,355,2019-06-08 08:32:59,dictumst morbi vestibulum velit id pretium iaculis diam erat fermentum justo
356,359,2019-10-04 09:45:09,quis tortor id nulla ultrices aliquet maecenas leo odio condimentum id
356,361,2019-05-05 08:58:26,erat curabitur gravida nisi at nibh
356,365,2019-08-11 11:32:58,sapien a libero nam dui proin leo odio
356,366,2019-08-12 04:21:06,dolor sit amet consectetuer adipiscing elit proin interdum mauris
356,367,2018-11-21 17:37:26,varius nulla facilisi cras non velit nec nisi vulputate nonummy maecenas tincidunt
356,369,2019-02-09 02:29:58,pellentesque ultrices mattis odio donec
373,375,2019-01-02 03:51:58,imperdiet et commodo vulputate justo in blandit ultrices enim lorem
373,376,2019-08-02 11:47:33,sagittis nam congue risus semper porta volutpat quam pede lobortis ligula sit
373,379,2019-02-27 13:38:12,diam neque vestibulum eget vulputate ut ultrices vel augue vestibulum ante ipsum
373,380,2019-08-25 04:57:02,eget massa tempor convallis nulla neque
373,382,2018-12-07 21:04:31,luctus cum sociis natoque penatibus
373,385,2019-04-30 18:52:34,cubilia curae mauris viverra diam vitae quam suspendisse potenti nullam porttitor lacus
373,391,2019-10-02 16:38:04,sem mauris laoreet ut rhoncus aliquet pulvinar sed nisl nunc rhoncus dui vel
373,397,2019-09-08 07:29:08,venenatis turpis enim blandit mi in porttitor pede justo eu
373,405,2018-12-06 09:00:30,eget orci vehicula
373,406,2019-05-23 19:50:10,fusce posuere felis sed lacus morbi sem mauris laoreet ut
373,410,2019-07-27 16:30:52,sed accumsan felis ut at dolor quis odio consequat
373,411,2018-11-28 23:16:25,vivamus in felis
373,414,2019-07-02 15:29:45,mattis pulvinar nulla pede ullamcorper augue a suscipit nulla elit
373,418,2019-09-08 16:24:34,in leo maecenas pulvinar lobortis est
373,424,2018-11-17 07:26:19,interdum in ante vestibulum ante ipsum primis in
87,86,2018-12-17 03:27:40,elit ac nulla sed vel enim sit amet nunc viverra dapibus nulla suscipit ligula
87,106,2018-11-08 13:03:39,vestibulum rutrum rutrum neque aenean auctor gravida sem praesent id massa id nisl
87,109,2019-01-25 22:03:53,nibh in hac habitasse platea
87,111,2018-11-24 02:06:06,ultrices aliquet maecenas leo odio condimentum id luctus nec molestie sed justo pellentesque viverra
87,113,2019-04-27 12:13:02,ac leo pellentesque
87,430,2019-07-23 10:33:38,augue aliquam erat volutpat in congue etiam justo
87,116,2019-03-30 21:29:34,eu est congue elementum in hac habitasse platea dictumst
87,15,2018-12-19 04:16:04,nibh in hac habitasse platea dictumst aliquam augue
87,120,2019-05-21 15:02:23,nisl venenatis lacinia aenean
87,431,2018-11-08 21:07:00,lectus in est risus auctor sed tristique in tempus sit amet
87,129,2019-02-27 07:10:18,quisque id justo sit
87,131,2018-12-23 01:59:17,hac habitasse platea dictumst etiam faucibus cursus urna ut tellus nulla
87,432,2019-09-01 03:08:33,sagittis sapien cum sociis natoque penatibus et magnis dis parturient montes nascetur
87,132,2019-07-01 00:02:32,justo eu massa donec dapibus duis at
87,438,2019-01-18 10:32:24,orci luctus et ultrices posuere cubilia curae nulla dapibus dolor vel
87,149,2019-01-30 06:43:50,in faucibus orci luctus et ultrices posuere
87,442,2018-10-05 09:27:17,in est risus auctor sed
87,160,2018-12-04 20:01:39,varius nulla facilisi cras non velit nec nisi vulputate nonummy maecenas tincidunt lacus at velit
444,447,2019-04-03 18:19:07,integer pede justo
444,449,2018-12-12 03:07:21,semper rutrum nulla nunc purus phasellus in felis donec
444,451,2018-12-11 06:54:26,quam sollicitudin vitae consectetuer eget rutrum at lorem integer tincidunt ante
444,452,2018-11-11 20:40:34,morbi sem mauris laoreet ut rhoncus aliquet pulvinar sed nisl nunc rhoncus
453,461,2019-07-20 09:13:00,rhoncus aliquam lacus morbi quis tortor id nulla ultrices aliquet maecenas
453,462,2019-05-27 04:50:09,ac tellus semper interdum mauris ullamcorper purus sit amet nulla quisque arcu libero rutrum
453,466,2019-01-31 16:04:04,viverra pede ac diam cras pellentesque volutpat dui maecenas tristique
453,467,2019-04-18 16:42:48,placerat praesent blandit nam nulla integer pede justo lacinia eget
453,468,2019-02-14 12:09:10,vestibulum eget vulputate ut ultrices vel augue vestibulum ante
453,469,2018-11-11 20:33:37,lectus aliquam sit amet diam in magna bibendum imperdiet nullam orci pede
453,473,2019-03-03 15:43:29,penatibus et magnis dis parturient montes nascetur ridiculus mus etiam
453,474,2019-06-25 10:45:07,erat tortor sollicitudin mi sit amet lobortis sapien sapien non mi integer ac
475,476,2019-07-16 19:29:25,quisque ut erat curabitur gravida nisi at nibh in hac habitasse platea dictumst
475,479,2019-03-11 08:05:58,nisi nam ultrices libero non mattis pulvinar nulla pede ullamcorper augue
475,480,2018-12-10 01:20:48,sed ante vivamus tortor
475,483,2019-06-03 17:40:50,dui maecenas tristique est et tempus semper est quam pharetra magna ac consequat
475,485,2019-01-07 11:28:02,accumsan tortor quis turpis sed ante vivamus tortor duis
475,487,2019-03-31 17:34:03,dui vel nisl duis ac nibh fusce lacus purus
475,489,2018-12-28 17:16:52,fusce posuere felis sed lacus morbi sem mauris laoreet ut rhoncus aliquet pulvinar
475,490,2019-06-23 08:56:35,ligula suspendisse ornare consequat lectus in est risus auctor
475,492,2019-03-06 18:13:22,velit nec nisi vulputate nonummy maecenas tincidunt lacus at velit
475,498,2019-06-06 12:07:45,consequat metus sapien ut nunc vestibulum ante
475,504,2019-06-24 02:28:21,vitae nisi nam ultrices libero non mattis pulvinar nulla pede ullamcorper
475,506,2019-05-19 13:13:16,nullam varius nulla facilisi cras non velit nec nisi vulputate
475,508,2019-02-26 10:08:48,curabitur gravida nisi at nibh in hac habitasse platea dictumst aliquam augue
88,509,2019-03-27 21:55:19,penatibus et magnis dis parturient montes nascetur ridiculus mus etiam
88,512,2019-08-23 02:25:41,pellentesque eget nunc donec quis orci eget orci vehicula condimentum curabitur in libero
88,513,2019-03-18 21:55:21,elit proin interdum mauris non
88,514,2019-01-24 07:26:47,ipsum ac tellus semper
88,517,2019-09-30 22:19:54,dignissim vestibulum vestibulum ante ipsum primis in faucibus orci luctus et ultrices
88,518,2019-03-18 09:30:08,amet diam in magna bibendum imperdiet nullam orci pede venenatis non sodales sed tincidunt
88,519,2018-12-02 00:47:31,curae mauris viverra diam vitae
88,524,2018-11-22 19:43:15,neque aenean auctor gravida sem praesent id massa
88,525,2019-03-27 00:22:29,amet erat nulla tempus vivamus in felis
88,526,2018-12-04 13:38:00,etiam faucibus cursus urna ut tellus nulla ut erat id mauris vulputate elementum
88,534,2018-11-28 18:29:17,sed lacus morbi sem mauris laoreet ut rhoncus aliquet pulvinar sed nisl nunc rhoncus
88,500,2019-09-07 19:14:53,sit amet consectetuer adipiscing elit
88,537,2019-05-04 05:25:19,consectetuer eget rutrum at lorem integer tincidunt ante vel ipsum praesent blandit lacinia erat
88,538,2018-12-24 02:17:54,in ante vestibulum ante ipsum primis in faucibus orci luctus et ultrices
88,541,2019-03-24 18:11:59,proin risus praesent lectus vestibulum quam sapien varius ut blandit non interdum in ante
88,545,2019-05-25 15:02:13,molestie lorem quisque ut erat curabitur gravida nisi at
549,553,2019-05-24 05:38:06,quam turpis adipiscing lorem vitae mattis nibh ligula nec sem duis
549,554,2018-10-22 00:24:32,vehicula consequat morbi a ipsum integer a nibh in quis justo maecenas rhoncus
555,557,2019-07-03 14:14:20,nibh in quis justo maecenas rhoncus aliquam lacus morbi quis tortor id nulla
60,559,2019-08-03 16:36:52,nulla integer pede justo lacinia eget tincidunt eget tempus vel pede morbi
60,245,2019-07-26 08:22:21,phasellus id sapien in sapien iaculis congue vivamus
60,560,2019-02-23 21:29:25,in faucibus orci luctus
60,563,2019-04-15 15:40:36,vestibulum sit amet cursus id
60,567,2019-02-07 03:19:22,cras non velit nec nisi vulputate
89,571,2019-10-05 13:28:05,pulvinar sed nisl nunc rhoncus dui vel sem sed
89,91,2019-03-28 01:52:39,duis mattis egestas metus aenean fermentum donec ut mauris eget massa tempor convallis nulla
89,96,2019-08-18 06:54:04,blandit mi in porttitor pede justo eu massa
89,427,2019-10-01 00:37:59,nulla pede ullamcorper augue a suscipit nulla elit ac nulla sed vel enim sit
89,101,2019-05-27 15:09:00,sit amet sem fusce
89,519,2019-01-30 08:31:33,lacinia eget tincidunt eget tempus vel pede morbi porttitor lorem id ligula suspendisse
89,103,2018-10-05 22:20:45,in felis donec semper sapien a libero nam dui proin leo
89,576,2018-10-19 18:41:17,neque libero convallis eget eleifend luctus ultricies
89,577,2019-07-29 20:04:48,eget elit sodales scelerisque mauris sit amet eros suspendisse accumsan tortor quis
89,578,2019-05-21 01:24:13,eget tincidunt eget tempus vel pede
89,117,2018-12-30 00:01:57,accumsan tortor quis turpis sed ante
89,120,2018-10-21 02:02:18,mauris eget massa
89,581,2018-11-15 17:26:15,justo aliquam quis turpis eget elit sodales scelerisque mauris sit
89,121,2019-03-28 10:07:55,porta volutpat quam pede lobortis ligula sit amet eleifend
89,585,2019-03-13 03:03:57,enim sit amet nunc viverra dapibus
89,586,2019-08-21 12:03:48,ipsum integer a nibh
89,129,2019-08-02 20:18:27,phasellus sit amet erat nulla tempus vivamus in felis eu sapien cursus vestibulum proin
89,131,2019-09-07 15:19:54,consequat varius integer ac leo pellentesque ultrices mattis odio donec
89,133,2019-04-15 04:01:59,lacus purus aliquet at feugiat non pretium quis
89,542,2019-06-11 12:14:53,nisl nunc rhoncus dui vel sem sed sagittis nam congue risus semper
89,435,2019-05-29 22:26:03,hac habitasse platea dictumst aliquam augue quam sollicitudin vitae consectetuer eget
89,595,2019-07-05 08:14:07,viverra eget congue eget semper rutrum nulla nunc purus phasellus
89,596,2018-11-29 01:09:02,maecenas pulvinar lobortis est
89,598,2019-05-30 01:06:50,sagittis dui vel nisl duis ac nibh fusce lacus purus aliquet at feugiat
89,601,2019-05-17 19:19:34,posuere cubilia curae donec pharetra magna vestibulum aliquet ultrices erat tortor sollicitudin
89,602,2018-11-01 20:41:23,morbi non lectus aliquam
89,439,2019-04-19 22:16:09,augue vestibulum ante ipsum primis in
89,146,2019-06-17 14:15:37,eu magna vulputate luctus cum sociis natoque penatibus et
89,147,2018-11-29 00:55:34,a nibh in quis justo maecenas rhoncus aliquam lacus morbi quis tortor
89,611,2019-06-11 06:30:12,sit amet lobortis sapien sapien non mi integer ac neque
89,614,2019-05-01 07:10:29,quis augue luctus tincidunt
89,443,2019-08-07 04:38:12,rhoncus sed vestibulum sit amet cursus id turpis integer aliquet massa id lobortis convallis tortor
570,89,2019-04-11 02:49:27,hac habitasse platea dictumst maecenas ut massa quis augue luctus
570,617,2018-11-02 05:44:57,augue aliquam erat
570,106,2019-01-24 21:19:01,id ligula suspendisse ornare consequat lectus in est risus auctor sed tristique in
570,619,2019-04-02 18:33:47,sed ante vivamus
570,621,2018-11-05 09:10:53,massa id nisl venenatis lacinia aenean sit amet justo morbi ut odio
570,151,2019-08-08 07:38:32,auctor sed tristique in
304,309,2019-04-07 10:48:34,morbi sem mauris laoreet
304,336,2018-10-10 05:37:21,rutrum nulla tellus in sagittis dui vel
304,338,2019-09-23 13:48:26,viverra pede ac diam cras pellentesque volutpat dui maecenas tristique est et tempus semper est
304,627,2018-12-08 23:05:21,quam pede lobortis
304,628,2018-12-28 00:49:37,pellentesque eget nunc donec quis
631,632,2019-05-02 08:16:07,ultrices aliquet maecenas leo odio condimentum id luctus nec molestie sed
631,634,2019-09-02 13:03:22,gravida sem praesent id
631,635,2019-02-12 02:37:57,morbi a ipsum integer a nibh
631,639,2019-05-02 09:23:27,montes nascetur ridiculus mus etiam vel augue vestibulum rutrum rutrum neque aenean auctor gravida sem
631,178,2018-12-03 17:53:04,maecenas pulvinar lobortis est phasellus sit amet erat nulla tempus vivamus in
631,644,2019-10-01 13:21:16,lobortis convallis tortor risus dapibus augue
631,647,2019-06-07 16:20:16,semper est quam pharetra magna ac consequat metus sapien ut nunc vestibulum ante
657,659,2019-01-30 14:05:25,lacus purus aliquet at feugiat non pretium quis lectus suspendisse
657,662,2018-11-12 02:56:06,vulputate vitae nisl aenean lectus pellentesque eget nunc donec quis
657,243,2019-03-24 14:35:34,turpis donec posuere metus vitae ipsum
657,665,2019-10-08 14:24:29,luctus et ultrices posuere cubilia curae duis faucibus accumsan odio curabitur
657,667,2019-02-05 16:04:16,eu magna vulputate luctus cum sociis natoque penatibus et
657,668,2019-04-07 22:40:08,luctus et ultrices posuere cubilia curae donec pharetra magna vestibulum aliquet ultrices erat tortor sollicitudin
657,669,2019-02-11 12:27:37,at lorem integer tincidunt ante vel ipsum praesent blandit lacinia erat vestibulum sed magna at
657,261,2019-06-15 01:33:23,sit amet eros
657,672,2019-02-02 22:58:38,velit vivamus vel nulla eget eros elementum pellentesque quisque porta
657,673,2019-09-29 18:17:53,duis consequat dui nec nisi volutpat
657,676,2018-12-30 18:31:36,diam vitae quam suspendisse potenti nullam
61,685,2019-06-03 23:17:30,hac habitasse platea dictumst etiam
61,686,2019-01-28 10:09:16,neque aenean auctor gravida sem praesent id massa id nisl venenatis
61,261,2019-04-18 02:55:30,sit amet nunc viverra dapibus nulla suscipit ligula in
61,687,2019-01-22 09:01:27,id ligula suspendisse ornare consequat lectus in est risus
61,689,2018-11-05 05:57:24,penatibus et magnis dis parturient montes nascetur ridiculus mus
61,699,2018-10-18 06:38:44,a ipsum integer a nibh in quis
61,702,2019-10-05 19:21:24,sit amet diam in magna bibendum imperdiet nullam orci pede
61,703,2019-06-18 02:48:59,mi nulla ac enim in tempor turpis nec euismod scelerisque quam turpis adipiscing
61,704,2019-04-27 16:26:01,mi nulla ac enim in tempor turpis nec euismod scelerisque quam
61,707,2019-09-01 10:11:44,odio justo sollicitudin ut suscipit
61,708,2018-10-26 18:55:30,eros elementum pellentesque quisque porta
61,710,2019-01-29 11:06:08,nam dui proin leo odio porttitor id consequat in consequat
711,712,2018-10-19 18:35:29,dolor vel est donec odio justo
711,713,2019-02-09 22:33:55,in tempus sit amet sem fusce consequat nulla nisl nunc nisl duis
711,717,2018-11-24 05:09:37,volutpat sapien arcu sed augue aliquam erat volutpat in
711,718,2019-03-02 03:46:00,mus etiam vel augue vestibulum
711,723,2019-10-07 00:57:39,nulla pede ullamcorper augue a suscipit nulla elit ac nulla
711,275,2019-06-25 20:04:43,sit amet eros suspendisse accumsan tortor quis turpis sed ante vivamus tortor duis mattis egestas
711,69,2019-07-10 00:42:11,convallis nunc proin at
711,297,2019-03-13 18:13:09,lectus pellentesque at nulla suspendisse potenti cras in purus eu magna vulputate luctus cum sociis
711,731,2019-05-25 17:22:02,consequat nulla nisl nunc nisl duis bibendum felis sed interdum
732,736,2018-10-24 12:14:29,nam ultrices libero non mattis pulvinar nulla pede
732,737,2018-12-11 10:10:05,id sapien in sapien iaculis congue vivamus metus arcu adipiscing molestie hendrerit at vulputate vitae
658,659,2019-09-09 09:16:48,gravida sem praesent id massa id
658,738,2019-07-07 02:00:36,faucibus orci luctus et
658,661,2019-06-20 20:53:45,augue vel accumsan tellus
658,740,2019-03-30 19:04:55,vestibulum aliquet ultrices
658,665,2018-10-27 10:48:54,faucibus orci luctus et ultrices posuere
658,741,2018-12-15 04:40:13,quam turpis adipiscing lorem vitae mattis nibh
658,742,2018-11-28 06:08:59,maecenas tincidunt lacus at velit vivamus vel nulla eget eros elementum pellentesque quisque porta
658,457,2019-05-11 11:00:19,nulla pede ullamcorper augue a suscipit nulla elit ac nulla sed vel
658,674,2019-01-07 16:02:08,nisl nunc rhoncus dui vel sem sed sagittis nam congue risus
658,746,2019-05-05 12:36:25,adipiscing elit proin risus praesent
658,677,2019-04-08 07:12:27,ultrices vel augue vestibulum ante ipsum primis
748,749,2019-07-03 00:56:41,ultrices phasellus id sapien in sapien iaculis congue vivamus
748,750,2019-07-07 12:52:24,sed vel enim sit amet nunc viverra dapibus nulla
748,751,2019-05-25 14:44:09,tellus in sagittis dui vel nisl duis ac nibh fusce lacus purus aliquet at feugiat
748,752,2019-05-11 14:38:42,quis justo maecenas rhoncus aliquam lacus morbi quis tortor id nulla ultrices aliquet maecenas
